{
  "$schema": "https://json-schema.org/draft/2020-12/schema",
  "title": "DB Backup Summary",
  "type": "object",
  "required": [
    "event_id",
    "module",
    "backup_type",
    "status",
    "summary",
    "recommended_policy",
    "updated_at"
  ],
  "properties": {
    "event_id": {"type": "string"},
    "module": {"const": "backup-recovery"},
    "backup_type": {"type": "string"},
    "status": {"type": "string", "enum": ["ok", "warning", "critical"]},
    "summary": {"type": "string"},
    "evidence": {"type": "array", "items": {"type": "string"}},
    "recommended_checks": {"type": "array", "items": {"type": "string"}},
    "recommended_policy": {"type": "string", "enum": ["pass", "hold", "block", "rollback", "fallback"]},
    "updated_at": {"type": "string"}
  }
}
